{
  "diagnostics": {
    "by_device": {
      "mobile": {
        "passing": 20,
        "total": 20
      },
      "robot": {
        "passing": 20,
        "total": 20
      },
      "tv": {
        "passing": 20,
        "total": 20
      }
    },
    "observed_count": 60,
    "passing": 60,
    "population_complete": true
  },
  "direction": "higher_is_better",
  "eligibility_status": "ELIGIBLE",
  "failed_gates": [],
  "official_scalar_metric": "Core-Preserving Device Adaptation Rate",
  "population_id": "qa06-device-adaptation-v1",
  "population_manifest_hash": "55cb85b9e61c5e223abeb3ad22270c6ac94d47bf8b1a79d820708c7603f736df",
  "provenance": {
    "alternative_id": "R3",
    "architecture_commit": "9bb81ef3ff3831342f39437c52e039f9015a79a1",
    "corpus_manifest_hash": "63bce004138dbd22df17cdeb85b0caf9c336a145b7ff43f6b9224ba8a56f8d5c",
    "corpus_manifest_id": "qa-v1-corpus-manifest-v1",
    "dp_id": "DP-00",
    "evidence_mode": "semantic_replay",
    "qa_contract_hash": "23d1ede2aebed95a5fb8d444b3c31878977d0bc5579d3091338ecff50fd415d4",
    "qa_contract_id": "qa-evaluation-contract-v1",
    "reference_environment_hash": "5064aee19d148702f8630be6ec00342e862082859c69481309d7bf62105d7eb2",
    "reference_environment_id": "via-reference-environment-v1",
    "run_id": "dp00-vnext-qa-v1-campaign-v1:R3:QA-06:official",
    "tactic_package": null
  },
  "qa_id": "QA-06",
  "qualification_status": "QUALIFIED",
  "raw_metric": 100.0,
  "score": 5,
  "target_met": true,
  "unit": "percent"
}
