{
  "diagnostics": {
    "frame_ms": 10,
    "latencies_ms": [
      10.0,
      10.0,
      10.0,
      10.0,
      10.0,
      10.0,
      10.0,
      10.0,
      10.0,
      10.0,
      10.0,
      10.0,
      10.0,
      10.0,
      10.0,
      10.0,
      10.0,
      10.0,
      10.0,
      10.0,
      10.0,
      10.0,
      10.0,
      10.0,
      10.0,
      10.0,
      10.0,
      10.0,
      10.0,
      10.0,
      10.0,
      10.0,
      10.0,
      10.0,
      10.0,
      10.0,
      10.0,
      10.0,
      10.0,
      10.0,
      10.0,
      10.0,
      10.0,
      10.0,
      10.0,
      10.0,
      10.0,
      10.0,
      10.0,
      10.0,
      10.0,
      10.0,
      10.0,
      10.0,
      10.0,
      10.0,
      10.0,
      10.0,
      10.0,
      10.0,
      10.0,
      10.0,
      10.0,
      10.0,
      10.0,
      10.0,
      10.0,
      10.0,
      10.0,
      10.0,
      10.0,
      10.0,
      10.0,
      10.0,
      10.0,
      10.0,
      10.0,
      10.0,
      10.0,
      10.0,
      10.0,
      10.0,
      10.0,
      10.0,
      10.0,
      10.0,
      10.0,
      10.0,
      10.0,
      10.0,
      10.0,
      10.0,
      10.0,
      10.0,
      10.0,
      10.0,
      10.0,
      10.0,
      10.0,
      10.0,
      10.0,
      10.0,
      10.0,
      10.0,
      10.0,
      10.0,
      10.0,
      10.0,
      10.0,
      10.0,
      10.0,
      10.0,
      10.0,
      10.0,
      10.0,
      10.0,
      10.0,
      10.0,
      10.0,
      10.0,
      10.0,
      10.0,
      10.0,
      10.0,
      10.0,
      10.0,
      10.0,
      10.0,
      10.0,
      10.0,
      10.0,
      10.0,
      10.0,
      10.0,
      10.0,
      10.0,
      10.0,
      10.0,
      10.0,
      10.0,
      10.0,
      10.0,
      10.0,
      10.0,
      10.0,
      10.0,
      10.0,
      10.0,
      10.0,
      10.0,
      10.0,
      10.0,
      10.0,
      10.0,
      10.0,
      10.0,
      10.0,
      10.0,
      10.0,
      10.0,
      10.0,
      10.0,
      10.0,
      10.0,
      10.0,
      10.0,
      10.0,
      10.0,
      10.0,
      10.0,
      10.0,
      10.0,
      10.0,
      10.0,
      10.0,
      10.0,
      10.0,
      10.0,
      10.0,
      10.0,
      10.0,
      10.0,
      10.0,
      10.0,
      10.0,
      10.0,
      10.0,
      10.0,
      10.0,
      10.0,
      10.0,
      10.0,
      10.0,
      10.0,
      10.0,
      10.0,
      10.0,
      10.0,
      10.0,
      10.0
    ],
    "observed_count": 200,
    "penalty_count": 0,
    "population_complete": true
  },
  "direction": "lower_is_better",
  "eligibility_status": "ELIGIBLE",
  "failed_gates": [],
  "official_scalar_metric": "Barge-in Audible Stop Latency p95",
  "population_id": "qa12-barge-in-v1",
  "population_manifest_hash": "2678782dedbd8e4f5978263dd854cadd44fb5fc1f81fa5a7466a629c99e58332",
  "provenance": {
    "alternative_id": "R1",
    "architecture_commit": "1e4b868842dc5188eb9be41042364341efa44155",
    "corpus_manifest_hash": "63bce004138dbd22df17cdeb85b0caf9c336a145b7ff43f6b9224ba8a56f8d5c",
    "corpus_manifest_id": "qa-v1-corpus-manifest-v1",
    "dp_id": "DP-00",
    "evidence_mode": "executed",
    "qa_contract_hash": "23d1ede2aebed95a5fb8d444b3c31878977d0bc5579d3091338ecff50fd415d4",
    "qa_contract_id": "qa-evaluation-contract-v1",
    "reference_environment_hash": "5064aee19d148702f8630be6ec00342e862082859c69481309d7bf62105d7eb2",
    "reference_environment_id": "via-reference-environment-v1",
    "run_id": "dp00-executable-reference-v3-qa-v1:R1:QA-12",
    "tactic_package": null
  },
  "qa_id": "QA-12",
  "qualification_status": "QUALIFIED",
  "raw_metric": 10.0,
  "score": 5,
  "target_met": true,
  "unit": "milliseconds"
}
